{
  "schema_version": 1,
  "challenge_id": "01K00000000000000000000004",
  "server_nonce": "AAAAAAAAAAAAAAAAAAAAAAAAAAAAAAAAAAAAAAAAAAA",
  "workspace_id": "01K00000000000000000000001",
  "runner_id": "01K00000000000000000000002",
  "audience": "bfb-runner",
  "origin": "https://bfb.synthetic.test",
  "public_key_thumbprint": "sha256:aaaaaaaaaaaaaaaaaaaaaaaaaaaaaaaaaaaaaaaaaaaaaaaaaaaaaaaaaaaaaaaa",
  "purpose": "token",
  "authorization_epoch": 1,
  "owner_authorization_epoch": 2,
  "grant_epoch": 3,
  "token_epoch": 0,
  "token_id": null,
  "request": null,
  "issued_at": "2026-09-11T20:00:00.000Z",
  "expires_at": "2026-09-11T20:01:00.000Z"
}
